### ISSUE TITLE
Server fails to connect to Web-Connect client

### ISSUE THREAD

**Issue by CodeAbyss** [FreeRDP/FreeRDP#3858]
Server/Client OS - Win 7 Pro x86

The server is listening on port 8080. When trying to connect through WebConnect, the server declines the connection with following logs. I have put some extra logs to exactly trace the call::

[12:49:42:955] [3104:00000d08] [INFO][com.freerdp.server.windows] - \
[12:49:42:955] [3104:00000d08] [INFO][com.freerdp.server.windows] - Starting server
[12:49:42:955] [3104:00000d08] [INFO][com.freerdp.core.listener] - Listening on :::8080
[12:49:42:955] [3104:00000d08] [INFO][com.freerdp.core.listener] - Listening on 0.0.0.0:8080
[12:50:09:070] [3104:00000ce0] [INFO][com.freerdp.server.windows] - Activating Mirror Driver
[12:50:09:085] [3104:00000ce0] [INFO][com.freerdp.server.windows] - Registering Peer: id=0 #=1
[12:50:09:117] [3104:00000ce0] [INFO][com.freerdp.server.windows] - We've got a client xxx.xx.x.x
**[12:50:09:132] [3104:00000ce0] [ERROR][com.freerdp.core] - tpdu_read_header:: Stream_SafeSeek failed
[12:50:09:148] [3104:00000ce0] [ERROR][com.freerdp.core] - tpdu_read_connection_request:: tpdu_read_header failed
[12:50:09:163] [3104:00000ce0] [ERROR][com.freerdp.core.nego] - nego_read_request:: tpdu_read_connection_request failed
[12:50:09:179] [3104:00000ce0] [ERROR][com.freerdp.core.connection] - rdp_server_accept_nego:: nego_read_request failed
[12:50:09:195] [3104:00000ce0] [ERROR][com.freerdp.core.peer] - peer_recv_callback: CONNECTION_STATE_INITIAL - rdp_server_accept_nego() fail
[12:50:09:226] [3104:00000ce0] [ERROR][com.freerdp.core.transport] - transport_check_fds: transport->ReceiveCallback() - -1**
[12:50:09:241] [3104:00000ce0] [ERROR][com.freerdp.server.windows] - Failed to check peer file descriptor
[12:50:09:257] [3104:00000ce0] [INFO][com.freerdp.server.windows] - Client xxx.xx.x.x disconnected.
[12:50:09:273] [3104:00000ce0] [INFO][com.freerdp.server.windows] - Unregistering Peer: id=0, #=0

WebConnect works fine when tried with mstsc and port 3389. The FreeRDP server also works fine if tried to connect through the mstsc client.

**Comment by CodeAbyss** [comment]
Anybody, any pointers, anything on this issue?

**Comment by akallabeth** [comment]
@CodeAbyss Sounds like some bytes are missing in a header. Would be interesting what the connection request looks like (maybe our parser has a bug, maybe there is some issue in the request?)

**Comment by CodeAbyss** [comment]
@akallabeth From what I have observed, 
**[11:50:39:293] [3004:00000680] [INFO][com.freerdp.core] - tpdu_read_header:: li = 22, code = 3, length = 3
Stream_SafeSeek:: Stream_GetRemainingLength returned = 1, size required = 5
[11:50:39:324] [3004:00000680] [ERROR][com.freerdp.core] - tpdu_read_header:: Stream_SafeSeek failed**

I have compared the packets (mstsc client and webconnect client) too using wireshark, the first 3 frames are identical. The fourth frame differs in terms of cookie length, IMHO. And, then the 5th frame is entirely different, FreeRDP server returns PSH, ACK to mstsc whereas it returns RST, ACK to WebConnect to eset the connection. I am hereby attaching the respective two frames for clarity in the issue.

MSTSC-FreeRDP communication::
FRAME 4::
No.     Time        Source                Destination           Protocol Length Info
      4 0.000982    mstsc_client          FreeRDP_server           HTTP     96     Continuation or non-HTTP traffic

Frame 4: 96 bytes on wire (768 bits), 96 bytes captured (768 bits)
    Arrival Time: Mar 14, 2017 10:40:50.633043000
    Epoch Time: 1489468250.633043000 seconds
    [Time delta from previous captured frame: 0.000184000 seconds]
    [Time delta from previous displayed frame: 0.000184000 seconds]
    [Time since reference or first frame: 0.000982000 seconds]
    Frame Number: 4
    Frame Length: 96 bytes (768 bits)
    Capture Length: 96 bytes (768 bits)
    [Frame is marked: False]
    [Frame is ignored: False]
    [Protocols in frame: eth:ip:tcp:http:data]
    [Coloring Rule Name: HTTP]
    [Coloring Rule String: http || tcp.port == 80]
Ethernet II, Src: xxx, Dst: xxx
    Destination: xxx
        Address: xxx
        .... ...0 .... .... .... .... = IG bit: Individual address (unicast)
        .... ..0. .... .... .... .... = LG bit: Globally unique address (factory default)
    Source: xxx
        Address: xxx
        .... ...0 .... .... .... .... = IG bit: Individual address (unicast)
        .... ..0. .... .... .... .... = LG bit: Globally unique address (factory default)
    Type: IP (0x0800)
Internet Protocol Version 4, Src: mstsc_client (mstsc_client), Dst: FreeRDP_server (FreeRDP_server)
    Version: 4
    Header length: 20 bytes
    Differentiated Services Field: 0x00 (DSCP 0x00: Default; ECN: 0x00: Not-ECT (Not ECN-Capable Transport))
        0000 00.. = Differentiated Services Codepoint: Default (0x00)
        .... ..00 = Explicit Congestion Notification: Not-ECT (Not ECN-Capable Transport) (0x00)
    Total Length: 82
    Identification: 0x682a (26666)
    Flags: 0x02 (Don't Fragment)
        0... .... = Reserved bit: Not set
        .1.. .... = Don't fragment: Set
        ..0. .... = More fragments: Not set
    Fragment offset: 0
    Time to live: 128
    Protocol: TCP (6)
    Header checksum: 0x363c [correct]
        [Good: True]
        [Bad: False]
    Source: mstsc_client (mstsc_client)
    Destination: FreeRDP_server (FreeRDP_server)
Transmission Control Protocol, Src Port: 59797 (59797), Dst Port: http-alt (8080), Seq: 1, Ack: 1, Len: 42
    Source port: 59797 (59797)
    Destination port: http-alt (8080)
    [Stream index: 0]
    Sequence number: 1    (relative sequence number)
    [Next sequence number: 43    (relative sequence number)]
    Acknowledgement number: 1    (relative ack number)
    Header length: 20 bytes
    Flags: 0x018 (PSH, ACK)
        000. .... .... = Reserved: Not set
        ...0 .... .... = Nonce: Not set
        .... 0... .... = Congestion Window Reduced (CWR): Not set
        .... .0.. .... = ECN-Echo: Not set
        .... ..0. .... = Urgent: Not set
        .... ...1 .... = Acknowledgement: Set
        .... .... 1... = Push: Set
        .... .... .0.. = Reset: Not set
        .... .... ..0. = Syn: Not set
        .... .... ...0 = Fin: Not set
    Window size value: 256
    [Calculated window size: 65536]
    [Window size scaling factor: 256]
    Checksum: 0x1454 [validation disabled]
        [Good Checksum: False]
        [Bad Checksum: False]
    [SEQ/ACK analysis]
        [Bytes in flight: 42]
Hypertext Transfer Protocol
    Data (42 bytes)

0000  03 00 00 2a 25 e0 00 00 00 00 00 43 6f 6f 6b 69   ...*%......Cooki
0010  65 3a 20 6d 73 74 73 68 61 73 68 3d 74 65 73 74   e: mstshash=test
0020  0d 0a 01 00 08 00 03 00 00 00                     ..........
        Data: 0300002a25e00000000000436f6f6b69653a206d73747368...
        [Length: 42]

		
FRAME 5::
No.     Time        Source                Destination           Protocol Length Info
      5 0.010270    FreeRdp_server           mstsc_client          HTTP     73     Continuation or non-HTTP traffic

Frame 5: 73 bytes on wire (584 bits), 73 bytes captured (584 bits)
    Arrival Time: Mar 14, 2017 10:40:50.642331000
    Epoch Time: 1489468250.642331000 seconds
    [Time delta from previous captured frame: 0.009288000 seconds]
    [Time delta from previous displayed frame: 0.009288000 seconds]
    [Time since reference or first frame: 0.010270000 seconds]
    Frame Number: 5
    Frame Length: 73 bytes (584 bits)
    Capture Length: 73 bytes (584 bits)
    [Frame is marked: False]
    [Frame is ignored: False]
    [Protocols in frame: eth:ip:tcp:http:data]
    [Coloring Rule Name: Checksum Errors]
    [Coloring Rule String: cdp.checksum_bad==1 || edp.checksum_bad==1 || ip.checksum_bad==1 || tcp.checksum_bad==1 || udp.checksum_bad==1 || sctp.checksum_bad==1 || mstp.checksum_bad==1]
Ethernet II, Src: xxx, Dst: xxx
    Destination: xxx
        Address: xxx
        .... ...0 .... .... .... .... = IG bit: Individual address (unicast)
        .... ..0. .... .... .... .... = LG bit: Globally unique address (factory default)
    Source: xxx
        Address: xxx
        .... ...0 .... .... .... .... = IG bit: Individual address (unicast)
        .... ..0. .... .... .... .... = LG bit: Globally unique address (factory default)
    Type: IP (0x0800)
Internet Protocol Version 4, Src: FreeRdp_server (FreeRdp_server), Dst: mstsc_client (mstsc_client)
    Version: 4
    Header length: 20 bytes
    Differentiated Services Field: 0x00 (DSCP 0x00: Default; ECN: 0x00: Not-ECT (Not ECN-Capable Transport))
        0000 00.. = Differentiated Services Codepoint: Default (0x00)
        .... ..00 = Explicit Congestion Notification: Not-ECT (Not ECN-Capable Transport) (0x00)
    Total Length: 59
    Identification: 0x3180 (12672)
    Flags: 0x02 (Don't Fragment)
        0... .... = Reserved bit: Not set
        .1.. .... = Don't fragment: Set
        ..0. .... = More fragments: Not set
    Fragment offset: 0
    Time to live: 128
    Protocol: TCP (6)
    Header checksum: 0x0000 [incorrect, should be 0x6cfd (maybe caused by "IP checksum offload"?)]
        [Good: False]
        [Bad: True]
            [Expert Info (Error/Checksum): Bad checksum]
                [Message: Bad checksum]
                [Severity level: Error]
                [Group: Checksum]
    Source: FreeRdp_server (FreeRdp_server)
    Destination: mstsc_client (mstsc_client)
Transmission Control Protocol, Src Port: http-alt (8080), Dst Port: 59797 (59797), Seq: 1, Ack: 43, Len: 19
    Source port: http-alt (8080)
    Destination port: 59797 (59797)
    [Stream index: 0]
    Sequence number: 1    (relative sequence number)
    [Next sequence number: 20    (relative sequence number)]
    Acknowledgement number: 43    (relative ack number)
    Header length: 20 bytes
    Flags: 0x018 (PSH, ACK)
        000. .... .... = Reserved: Not set
        ...0 .... .... = Nonce: Not set
        .... 0... .... = Congestion Window Reduced (CWR): Not set
        .... .0.. .... = ECN-Echo: Not set
        .... ..0. .... = Urgent: Not set
        .... ...1 .... = Acknowledgement: Set
        .... .... 1... = Push: Set
        .... .... .0.. = Reset: Not set
        .... .... ..0. = Syn: Not set
        .... .... ...0 = Fin: Not set
    Window size value: 256
    [Calculated window size: 65536]
    [Window size scaling factor: 256]
    Checksum: 0x5c6d [validation disabled]
        [Good Checksum: False]
        [Bad Checksum: False]
    [SEQ/ACK analysis]
        [This is an ACK to the segment in frame: 4]
        [The RTT to ACK the segment was: 0.009288000 seconds]
        [Bytes in flight: 19]
Hypertext Transfer Protocol
    Data (19 bytes)

0000  03 00 00 13 0e d0 00 00 00 00 00 02 01 08 00 02   ................
0010  00 00 00                                          ...
        Data: 030000130ed000000000000201080002000000
        [Length: 19]

WebConnect-FreeRDP communication::
FRAME 4::
No.     Time        Source                Destination           Protocol Length Info
      4 0.001695    WebConnect_client          FreeRDP_server           HTTP     281    Continuation or non-HTTP traffic

Frame 4: 281 bytes on wire (2248 bits), 281 bytes captured (2248 bits)
    Arrival Time: Mar 14, 2017 10:44:30.998172000
    Epoch Time: 1489468470.998172000 seconds
    [Time delta from previous captured frame: 0.001422000 seconds]
    [Time delta from previous displayed frame: 0.001422000 seconds]
    [Time since reference or first frame: 0.001695000 seconds]
    Frame Number: 4
    Frame Length: 281 bytes (2248 bits)
    Capture Length: 281 bytes (2248 bits)
    [Frame is marked: False]
    [Frame is ignored: False]
    [Protocols in frame: eth:ip:tcp:http:data]
    [Coloring Rule Name: HTTP]
    [Coloring Rule String: http || tcp.port == 80]
Ethernet II, Src: xxx, Dst: xxx
    Destination: xxx
        Address: xxx
        .... ...0 .... .... .... .... = IG bit: Individual address (unicast)
        .... ..0. .... .... .... .... = LG bit: Globally unique address (factory default)
    Source: xxx
        Address: xxx
        .... ...0 .... .... .... .... = IG bit: Individual address (unicast)
        .... ..0. .... .... .... .... = LG bit: Globally unique address (factory default)
    Type: IP (0x0800)
Internet Protocol Version 4, Src: WebConnect_client (WebConnect_client), Dst: FreeRDP_server (FreeRDP_server)
    Version: 4
    Header length: 20 bytes
    Differentiated Services Field: 0x00 (DSCP 0x00: Default; ECN: 0x00: Not-ECT (Not ECN-Capable Transport))
        0000 00.. = Differentiated Services Codepoint: Default (0x00)
        .... ..00 = Explicit Congestion Notification: Not-ECT (Not ECN-Capable Transport) (0x00)
    Total Length: 267
    Identification: 0x0b48 (2888)
    Flags: 0x02 (Don't Fragment)
        0... .... = Reserved bit: Not set
        .1.. .... = Don't fragment: Set
        ..0. .... = More fragments: Not set
    Fragment offset: 0
    Time to live: 128
    Protocol: TCP (6)
    Header checksum: 0x9065 [correct]
        [Good: True]
        [Bad: False]
    Source: WebConnect_client (WebConnect_client)
    Destination: FreeRDP_server (FreeRDP_server)
Transmission Control Protocol, Src Port: 49283 (49283), Dst Port: http-alt (8080), Seq: 1, Ack: 1, Len: 227
    Source port: 49283 (49283)
    Destination port: http-alt (8080)
    [Stream index: 0]
    Sequence number: 1    (relative sequence number)
    [Next sequence number: 228    (relative sequence number)]
    Acknowledgement number: 1    (relative ack number)
    Header length: 20 bytes
    Flags: 0x018 (PSH, ACK)
        000. .... .... = Reserved: Not set
        ...0 .... .... = Nonce: Not set
        .... 0... .... = Congestion Window Reduced (CWR): Not set
        .... .0.. .... = ECN-Echo: Not set
        .... ..0. .... = Urgent: Not set
        .... ...1 .... = Acknowledgement: Set
        .... .... 1... = Push: Set
        .... .... .0.. = Reset: Not set
        .... .... ..0. = Syn: Not set
        .... .... ...0 = Fin: Not set
    Window size value: 256
    [Calculated window size: 65536]
    [Window size scaling factor: 256]
    Checksum: 0x9b60 [validation disabled]
        [Good Checksum: False]
        [Bad Checksum: False]
    [SEQ/ACK analysis]
        [Bytes in flight: 227]
Hypertext Transfer Protocol
    Data (227 bytes)

0000  16 03 01 00 de 01 00 00 da 03 01 48 6c bc 04 6a   ...........Hl..j
0010  56 af d4 fc 5d ca 1e db 34 0f 02 c5 63 7b 94 3d   V...]...4...c{.=
0020  eb 2d 4a a8 08 17 d3 72 17 09 5f 00 00 68 c0 14   .-J....r.._..h..
0030  c0 0a c0 22 c0 21 00 39 00 38 00 88 00 87 c0 0f   ...".!.9.8......
0040  c0 05 00 35 00 84 c0 12 c0 08 c0 1c c0 1b 00 16   ...5............
0050  00 13 c0 0d c0 03 00 0a c0 13 c0 09 c0 1f c0 1e   ................
0060  00 33 00 32 00 9a 00 99 00 45 00 44 c0 0e c0 04   .3.2.....E.D....
0070  00 2f 00 96 00 41 00 07 c0 11 c0 07 c0 0c c0 02   ./...A..........
0080  00 05 00 04 00 15 00 12 00 09 00 14 00 11 00 08   ................
0090  00 06 00 03 00 ff 01 00 00 49 00 0b 00 04 03 00   .........I......
00a0  01 02 00 0a 00 34 00 32 00 0e 00 0d 00 19 00 0b   .....4.2........
00b0  00 0c 00 18 00 09 00 0a 00 16 00 17 00 08 00 06   ................
00c0  00 07 00 14 00 15 00 04 00 05 00 12 00 13 00 01   ................
00d0  00 02 00 03 00 0f 00 10 00 11 00 23 00 00 00 0f   ...........#....
00e0  00 01 01                                          ...
        Data: 16030100de010000da0301486cbc046a56afd4fc5dca1edb...
        [Length: 227]

		
FRAME 5::
No.     Time        Source                Destination           Protocol Length Info
      5 0.014061    FreeRDP_server           WebConnect_client          TCP      54     http-alt > 49283 [RST, ACK] Seq=1 Ack=228 Win=0 Len=0

Frame 5: 54 bytes on wire (432 bits), 54 bytes captured (432 bits)
    Arrival Time: Mar 14, 2017 10:44:31.010538000
    Epoch Time: 1489468471.010538000 seconds
    [Time delta from previous captured frame: 0.012366000 seconds]
    [Time delta from previous displayed frame: 0.012366000 seconds]
    [Time since reference or first frame: 0.014061000 seconds]
    Frame Number: 5
    Frame Length: 54 bytes (432 bits)
    Capture Length: 54 bytes (432 bits)
    [Frame is marked: False]
    [Frame is ignored: False]
    [Protocols in frame: eth:ip:tcp]
    [Coloring Rule Name: TCP RST]
    [Coloring Rule String: tcp.flags.reset eq 1]
Ethernet II, Src: xxx, Dst: xxx
    Destination: xxx
        Address: xxx
        .... ...0 .... .... .... .... = IG bit: Individual address (unicast)
        .... ..0. .... .... .... .... = LG bit: Globally unique address (factory default)
    Source: xxx
        Address: xxx
        .... ...0 .... .... .... .... = IG bit: Individual address (unicast)
        .... ..0. .... .... .... .... = LG bit: Globally unique address (factory default)
    Type: IP (0x0800)
Internet Protocol Version 4, Src: FreeRDP_server (FreeRDP_server), Dst: WebConnect_client (WebConnect_client)
    Version: 4
    Header length: 20 bytes
    Differentiated Services Field: 0x00 (DSCP 0x00: Default; ECN: 0x00: Not-ECT (Not ECN-Capable Transport))
        0000 00.. = Differentiated Services Codepoint: Default (0x00)
        .... ..00 = Explicit Congestion Notification: Not-ECT (Not ECN-Capable Transport) (0x00)
    Total Length: 40
    Identification: 0x3fca (16330)
    Flags: 0x02 (Don't Fragment)
        0... .... = Reserved bit: Not set
        .1.. .... = Don't fragment: Set
        ..0. .... = More fragments: Not set
    Fragment offset: 0
    Time to live: 128
    Protocol: TCP (6)
    Header checksum: 0x0000 [incorrect, should be 0x5cc6 (maybe caused by "IP checksum offload"?)]
        [Good: False]
        [Bad: True]
            [Expert Info (Error/Checksum): Bad checksum]
                [Message: Bad checksum]
                [Severity level: Error]
                [Group: Checksum]
    Source: FreeRDP_server (FreeRDP_server)
    Destination: WebConnect_client (WebConnect_client)
Transmission Control Protocol, Src Port: http-alt (8080), Dst Port: 49283 (49283), Seq: 1, Ack: 228, Len: 0
    Source port: http-alt (8080)
    Destination port: 49283 (49283)
    [Stream index: 0]
    Sequence number: 1    (relative sequence number)
    Acknowledgement number: 228    (relative ack number)
    Header length: 20 bytes
    Flags: 0x014 (RST, ACK)
        000. .... .... = Reserved: Not set
        ...0 .... .... = Nonce: Not set
        .... 0... .... = Congestion Window Reduced (CWR): Not set
        .... .0.. .... = ECN-Echo: Not set
        .... ..0. .... = Urgent: Not set
        .... ...1 .... = Acknowledgement: Set
        .... .... 0... = Push: Not set
        .... .... .1.. = Reset: Set
            [Expert Info (Chat/Sequence): Connection reset (RST)]
                [Message: Connection reset (RST)]
                [Severity level: Chat]
                [Group: Sequence]
        .... .... ..0. = Syn: Not set
        .... .... ...0 = Fin: Not set
    Window size value: 0
    [Calculated window size: 0]
    [Window size scaling factor: 256]
    Checksum: 0x5e5a [validation disabled]
        [Good Checksum: False]
        [Bad Checksum: False]
    [SEQ/ACK analysis]
        [This is an ACK to the segment in frame: 4]
        [The RTT to ACK the segment was: 0.012366000 seconds]

**Comment by CodeAbyss** [comment]
Somebody kindly pick up this issue

**Comment by akallabeth** [comment]
@CodeAbyss From a first look it seems that webconnect is at fault here, but I'm lacking the resources to debug this properly. Did you also open an issue in their tracker?

**Comment by CodeAbyss** [comment]
@akallabeth I will open the issue with them.

**Comment by akallabeth** [comment]
any update on this?

**Comment by CodeAbyss** [comment]
I don't remember exactly but it was something related to using either NLA or TLS and not both.

**Comment by akallabeth** [comment]
@CodeAbyss so a webconnect or freerdp issue (or in other words, can this be closed?)

**Comment by CodeAbyss** [comment]
Yeah, positively, it's webconnect issue. We can close this ticket.
